{
  "schema_version": 1,
  "source": {
    "commit": "a8d2cda3348a1744bf9e40e0ab5411721770005d",
    "tree": "2f4949028ebb80f5f369f2fba69fa714ea60438f",
    "branch": "release/crabedence-v1-hardening",
    "dirty": false
  },
  "toolchains": {
    "go": "go version go1.26.5 darwin/arm64",
    "node": "v22.22.3",
    "npm": "10.9.8",
    "git": "git version 2.52.0",
    "postgres_client": "psql (PostgreSQL) 14.20 (Homebrew)",
    "worker_package_version": "0.50.0"
  },
  "environment": {
    "os": "Darwin",
    "os_version": "25.2.0",
    "arch": "arm64",
    "date": "2026-09-08T23:30:23Z"
  },
  "gates": [{"name":"source_manifest","status":"PASS","exit":0,"log":"source-manifest-verify.log"},{"name":"go-vet","status":"PASS","exit":0,"log":"go-vet.log"},{"name":"go-evidence-tests","status":"PASS","exit":0,"log":"go-evidence-tests.log"},{"name":"go-tart-tests","status":"PASS","exit":0,"log":"go-tart-tests.log"},{"name":"go-lume-tests","status":"PASS","exit":0,"log":"go-lume-tests.log"},{"name":"go-shared-tests","status":"PASS","exit":0,"log":"go-shared-tests.log"},{"name":"go-race-evidence","status":"PASS","exit":0,"log":"go-race-evidence.log"},{"name":"go-race-providers","status":"PASS","exit":0,"log":"go-race-providers.log"},{"name":"postgres-fencing","status":"PASS","exit":0,"log":"postgres-fencing.log"},{"name":"postgres-parity","status":"PASS","exit":0,"log":"postgres-parity.log"},{"name":"cross-language-conformance","status":"PASS","exit":0,"log":"cross-language-conformance.log"},{"name":"worker-typecheck","status":"PASS","exit":0,"log":"worker-typecheck.log"},{"name":"worker-tests","status":"PASS","exit":0,"log":"worker-tests.log"},{"name":"worker-format","status":"PASS","exit":0,"log":"worker-format.log"},{"name":"worker-lint","status":"PASS","exit":0,"log":"worker-lint.log"},{"name":"worker-build","status":"PASS","exit":0,"log":"worker-build.log"}],
  "gate_summary": {
    "total": 16,
    "passed": 16,
    "failed": 0
  },
  "release_status": "PASS",
  "artifact_promotable": true,
  "invariants": [
    {"id": "CRAB-V1-001", "description": "V3 receipt always binds evidence_sha256"},
    {"id": "CRAB-V1-002", "description": "V2 receipt can never contain evidence_sha256"},
    {"id": "CRAB-V1-003", "description": "receipt evidence digest equals canonical RunEvidenceV1 SHA-256"},
    {"id": "CRAB-V1-004", "description": "Go and TypeScript produce identical canonical evidence"},
    {"id": "CRAB-V1-005", "description": "Go and TypeScript accept/reject identical receipt/evidence domains"},
    {"id": "CRAB-V1-006", "description": "startup confirmation failure evidence survives to RunEvidenceV1"},
    {"id": "CRAB-V1-007", "description": "detached providers never advertise exit observability"},
    {"id": "CRAB-V1-008", "description": "persistence failure cannot alter FinalRunOutcome"},
    {"id": "CRAB-V1-009", "description": "new mutations fail after coordinator authority loss"},
    {"id": "CRAB-V1-010", "description": "replacement mutations cannot overlap pre-admitted old-coordinator mutations"},
    {"id": "CRAB-V1-011", "description": "qualified source tree equals packaged source tree"},
    {"id": "CRAB-V1-012", "description": "every mandatory qualification gate was executed and passed"}
  ]
}
